<?xml version="1.0" encoding="UTF-8"?>
<HK74CE_oktatas xmlns:xsi="http://www.w3.org/2001/XMLSchema-instance"
 xsi:noNamespaceSchemaLocation="XMLSchemaHK74CE.xsd">
    <!-- Diákok -->
    <Diakok>
        <!-- Diák példány #1 -->
        <Diak>
            <DiakID>HK74CE</DiakID>
            <Nev>
                <Keresztnev>Bence</Keresztnev>
                <Vezeteknev>Varga</Vezeteknev>
            </Nev>
            <SzulDatum>2000-05-12</SzulDatum>
            <Email>varga.bence2000@gmail.com</Email>
            <Email>varga.bence@student.uni-miskolc.hu</Email>
            <Lakcim>
                <Varos>Tiszafüred</Varos>
                <Utca>Bán Zsigmond</Utca>
                <Hazszam>02</Hazszam>
            </Lakcim>
        </Diak>
        <!-- Diák példány #2 -->
        <Diak>
            <DiakID>AAA000</DiakID>
            <Nev>
                <Keresztnev>Anna</Keresztnev>
                <Vezeteknev>Nagy</Vezeteknev>
            </Nev>
            <SzulDatum>1999-08-22</SzulDatum>
            <Email>anna.nagy@example.com</Email>
            <Lakcim>
                <Varos>Szeged</Varos>
                <Utca>Kossuth tér</Utca>
                <Hazszam>5</Hazszam>
            </Lakcim>
        </Diak>
        <!-- Diák példány #3 -->
        <Diak>
            <DiakID>BBB000</DiakID>
            <Nev>
                <Keresztnev>Péter</Keresztnev>
                <Vezeteknev>Kis</Vezeteknev>
            </Nev>
            <SzulDatum>2001-11-03</SzulDatum>
            <Email>peter.kis@example.com</Email>
            <Email>peter.kis@student.uni-miskolc.hu</Email>
            <Lakcim>
                <Varos>Debrecen</Varos>
                <Utca>Nagy utca</Utca>
                <Hazszam>8</Hazszam>
            </Lakcim>
        </Diak>
    </Diakok>

    <!-- Tanárok -->
    <Tanarok>
        <!-- Tanár példány #1 -->
        <Tanar>
            <TanarID>101</TanarID>
            <Nev>
                <Keresztnev>Anna</Keresztnev>
                <Vezeteknev>Szabó</Vezeteknev>
            </Nev>
            <Beosztas>Docens</Beosztas>
            <Szakterulet>Informatika</Szakterulet>
        </Tanar>
        <!-- Tanár példány #2 -->
        <Tanar>
            <TanarID>102</TanarID>
            <Nev>
                <Keresztnev>Balázs</Keresztnev>
                <Vezeteknev>Fekete</Vezeteknev>
            </Nev>
            <Beosztas>Adjunktus</Beosztas>
            <Szakterulet>Matematika</Szakterulet>
        </Tanar>
        <!-- Tanár példány #3 -->
        <Tanar>
            <TanarID>103</TanarID>
            <Nev>
                <Keresztnev>Mária</Keresztnev>
                <Vezeteknev>Fehér</Vezeteknev>
            </Nev>
            <Beosztas>Oktató</Beosztas>
            <Szakterulet>Fizika</Szakterulet>
        </Tanar>
    </Tanarok>

    <!-- Tantárgyak -->
    <Tantargyak>
        <!-- Tantárgy példány #1 -->
        <Tantargy>
            <TargyID>MAT101</TargyID>
            <Nev>Matematika</Nev>
            <Kredit>5</Kredit>
            <Nyelv>Magyar</Nyelv>
            <Nyelv>Angol</Nyelv>
        </Tantargy>
        <!-- Tantárgy példány #2 -->
        <Tantargy>
            <TargyID>INF202</TargyID>
            <Nev>Informatika</Nev>
            <Kredit>6</Kredit>
            <Nyelv>Magyar</Nyelv>
        </Tantargy>
        <!-- Tantárgy példány #3 -->
        <Tantargy>
            <TargyID>FIZ303</TargyID>
            <Nev>Angol</Nev>
            <Kredit>4</Kredit>
            <Nyelv>Angol</Nyelv>
        </Tantargy>
    </Tantargyak>

    <!-- Termek -->
    <Termek>
        <!-- Terem példány #1 -->
        <Terem>
            <TeremID>101</TeremID>
            <Nev>Eloadoterem A</Nev>
            <Kapacitas>100</Kapacitas>
            <Felszereles>Projektor</Felszereles>
            <Felszereles>Tábla</Felszereles>
        </Terem>
        <!-- Terem példány #2 -->
        <Terem>
            <TeremID>102</TeremID>
            <Nev>Labor B</Nev>
            <Kapacitas>30</Kapacitas>
            <Felszereles>Számítógépek</Felszereles>
        </Terem>
        <!-- Terem példány #3 -->
        <Terem>
            <TeremID>103</TeremID>
            <Nev>Eloadoterem C</Nev>
            <Kapacitas>50</Kapacitas>
            <Felszereles>Tábla</Felszereles>
        </Terem>
    </Termek>

    <!-- Kurzusok -->
    <Kurzusok>
        <!-- Kurzus példány #1 -->
        <Kurzus>
            <KurzusID>KURZ001</KurzusID>
            <Idopont>2024.12.05.</Idopont>
            <Tipus>
                <Eloadas>true</Eloadas>
                <Gyakorlat>false</Gyakorlat>
            </Tipus>
            <Letszam>30</Letszam>
        </Kurzus>
        <!-- Kurzus példány #2 -->
        <Kurzus>
            <KurzusID>KURZ002</KurzusID>
            <Idopont>2024.12.06.</Idopont>
            <Tipus>
                <Eloadas>false</Eloadas>
                <Gyakorlat>true</Gyakorlat>
            </Tipus>
            <Letszam>25</Letszam>
        </Kurzus>
        <!-- Kurzus példány #3 -->
        <Kurzus>
            <KurzusID>KURZ003</KurzusID>
            <Idopont>2024.12.07.</Idopont>
            <Tipus>
                <Eloadas>true</Eloadas>
                <Gyakorlat>true</Gyakorlat>
            </Tipus>
            <Letszam>40</Letszam>
        </Kurzus>
    </Kurzusok>

    <!-- Kapcsolatok -->
    <Kapcsolatok>
        <!-- Diák-Kurzus kapcsolat -->
        <DiakKurzusKapcsolatok>
            <Kapcsolat>
                <DiakID>1</DiakID>
                <KurzusID>KURZ001</KurzusID>
                <Vizsga>90</Vizsga>
                <Alairas>aláírva</Alairas>
            </Kapcsolat>
            <Kapcsolat>
                <DiakID>2</DiakID>
                <KurzusID>KURZ002</KurzusID>
                <Vizsga>10</Vizsga>
                <Alairas>megtagadva</Alairas>
            </Kapcsolat>
            <Kapcsolat>
                <DiakID>3</DiakID>
                <KurzusID>KURZ003</KurzusID>
                <Vizsga>80</Vizsga>
                <Alairas>aláírva</Alairas>
            </Kapcsolat>
        </DiakKurzusKapcsolatok>

    </Kapcsolatok>
</HK74CE_oktatas>
