<?xml version="1.0" encoding="UTF-8" standalone="no"?>
<HK74CE_oktatas xmlns:xsi="http://www.w3.org/2001/XMLSchema-instance" xsi:noNamespaceSchemaLocation="XMLSchemaHK74CE.xsd">
      
  <!-- Diákok -->
      
  <Diakok>
            
    <Diak DiakID="1">
                  
      <Nev>
                        
        <Keresztnev>Bence</Keresztnev>
                        
        <Vezeteknev>Varga</Vezeteknev>
                    
      </Nev>
                  
      <SzulDatum>2000-05-12</SzulDatum>
                  
      <Email>varga.bence2000@gmail.com</Email>
                  
      <Email>varga.bence@student.uni-miskolc.hu</Email>
                  
      <Lakcim>
                        
        <Varos>Tiszafüred</Varos>
                        
        <Utca>Bán Zsigmond</Utca>
                        
        <Hazszam>02</Hazszam>
                    
      </Lakcim>
              
    </Diak>
            
    <Diak DiakID="2">
                  
      <Nev>
                        
        <Keresztnev>Anna</Keresztnev>
                        
        <Vezeteknev>Nagy</Vezeteknev>
                    
      </Nev>
                  
      <SzulDatum>1999-08-22</SzulDatum>
                  
      <Email>anna.nagy@example.com</Email>
                  
      <Email>anna.student@example.com</Email>
                  
      <Email>anna.office@example.hu</Email>
                  
      <Lakcim>
                        
        <Varos>Szeged</Varos>
                        
        <Utca>Kossuth tér</Utca>
                        
        <Hazszam>5</Hazszam>
                    
      </Lakcim>
              
    </Diak>
            
    <Diak DiakID="3">
                  
      <Nev>
                        
        <Keresztnev>Péter</Keresztnev>
                        
        <Vezeteknev>Kis</Vezeteknev>
                    
      </Nev>
                  
      <SzulDatum>2001-11-03</SzulDatum>
                  
      <Email>peter.kis@example.com</Email>
                  
      <Email>peter.kis@student.uni-miskolc.hu</Email>
                  
      <Lakcim>
                        
        <Varos>Debrecen</Varos>
                        
        <Utca>Nagy utca</Utca>
                        
        <Hazszam>8</Hazszam>
                    
      </Lakcim>
              
    </Diak>
        
  </Diakok>
      
  <!-- Tanárok -->
      
  <Tanarok>
            
    <Tanar TanarID="101">
                  
      <Nev>
                        
        <Keresztnev>Anna</Keresztnev>
                        
        <Vezeteknev>Szabó</Vezeteknev>
                    
      </Nev>
                  
      <Beosztas>Docens</Beosztas>
                  
      <Szakterulet>Informatika</Szakterulet>
              
    </Tanar>
            
    <Tanar TanarID="102">
                  
      <Nev>
                        
        <Keresztnev>Balázs</Keresztnev>
                        
        <Vezeteknev>Fekete</Vezeteknev>
                    
      </Nev>
                  
      <Beosztas>Adjunktus</Beosztas>
                  
      <Szakterulet>Matematika</Szakterulet>
              
    </Tanar>
            
    <Tanar TanarID="103">
                  
      <Nev>
                        
        <Keresztnev>Mária</Keresztnev>
                        
        <Vezeteknev>Fehér</Vezeteknev>
                    
      </Nev>
                  
      <Beosztas>Oktató</Beosztas>
                  
      <Szakterulet>Fizika</Szakterulet>
              
    </Tanar>
        
  </Tanarok>
      
  <!-- Tantárgyak -->
      
  <Tantargyak>
            
    <Tantargy TargyID="MAT101">
                  
      <Nev>Matematika</Nev>
                  
      <Kredit>5</Kredit>
                  
      <Nyelv>Magyar</Nyelv>
                  
      <Nyelv>Angol</Nyelv>
              
    </Tantargy>
            
    <Tantargy TargyID="INF202">
                  
      <Nev>Informatika</Nev>
                  
      <Kredit>5</Kredit>
                  
      <Nyelv>Magyar</Nyelv>
              
    </Tantargy>
            
    <Tantargy TargyID="FIZ303">
                  
      <Nev>Fizika</Nev>
                  
      <Kredit>4</Kredit>
                  
      <Nyelv>Angol</Nyelv>
              
    </Tantargy>
        
  </Tantargyak>
      
  <!-- Termek -->
      
  <Termek>
            
    <Terem TeremID="101">
                  
      <Nev>Eloadoterem A</Nev>
                  
      <Kapacitas>100</Kapacitas>
                  
      <Felszereles>Projektor</Felszereles>
                  
      <Felszereles>Tábla</Felszereles>
                  
      <Felszereles>Függöny</Felszereles>
              
    </Terem>
            
    <Terem TeremID="102">
                  
      <Nev>Labor B</Nev>
                  
      <Kapacitas>30</Kapacitas>
                  
      <Felszereles>Számítógépek</Felszereles>
              
    </Terem>
            
    <Terem TeremID="103">
                  
      <Nev>Eloadoterem C</Nev>
                  
      <Kapacitas>50</Kapacitas>
                  
      <Felszereles>Tábla</Felszereles>
              
    </Terem>
        
  </Termek>
      
  <!-- Kurzusok -->
      
  <Kurzusok>
            
    <Kurzus KurzusID="KURZ001">
                  
      <Idopont>2024-12-05</Idopont>
                  
      <Tipus>
                        
        <Eloadas>true</Eloadas>
                        
        <Gyakorlat>false</Gyakorlat>
                    
      </Tipus>
                  
      <Letszam>30</Letszam>
              
    </Kurzus>
            
    <Kurzus KurzusID="KURZ002">
                  
      <Idopont>2024-12-06</Idopont>
                  
      <Tipus>
                        
        <Eloadas>false</Eloadas>
                        
        <Gyakorlat>true</Gyakorlat>
                    
      </Tipus>
                  
      <Letszam>25</Letszam>
              
    </Kurzus>
            
    <Kurzus KurzusID="KURZ003">
                  
      <Idopont>2024-12-07</Idopont>
                  
      <Tipus>
                        
        <Eloadas>true</Eloadas>
                        
        <Gyakorlat>true</Gyakorlat>
                    
      </Tipus>
                  
      <Letszam>40</Letszam>
              
    </Kurzus>
        
  </Kurzusok>
      
  <!-- Kapcsolatok -->
      
  <Kapcsolatok>
            
    <DiakKurzusKapcsolatok>
                  
      <Kapcsolat DiakID="1" KurzusID="KURZ001">
                        
        <Vizsga>90</Vizsga>
                        
        <Alairas>aláírva</Alairas>
                    
      </Kapcsolat>
                  
      <Kapcsolat DiakID="2" KurzusID="KURZ002">
                        
        <Vizsga>10</Vizsga>
                        
        <Alairas>megtagadva</Alairas>
                    
      </Kapcsolat>
                  
      <Kapcsolat DiakID="3" KurzusID="KURZ003">
                        
        <Vizsga>80</Vizsga>
                        
        <Alairas>aláírva</Alairas>
                    
      </Kapcsolat>
              
    </DiakKurzusKapcsolatok>
        
  </Kapcsolatok>
  
</HK74CE_oktatas>
